=================================================
🧠 Vectorizing Opticwise Transcripts
=================================================

✅ Connected to index: opticwise-transcripts

📥 Found 136 transcripts to vectorize

[1/136] PPP Podcast  intro call with Navjeet Chhina
  Created 5 chunks
  Batch 1/1: Embedding 5 chunks...
  ✅ Upserted 5 vectors
  ✅ Complete

[2/136] PPP Podcast  intro call with Allen Witters
  Created 14 chunks
  Batch 1/1: Embedding 14 chunks...
  ✅ Upserted 14 vectors
  ✅ Complete

[3/136] PPP Podcast  intro call with Reuben Levine
  Created 10 chunks
  Batch 1/1: Embedding 10 chunks...
  ✅ Upserted 10 vectors
  ✅ Complete

[4/136] Richard Reyes | Meeting 
  Created 13 chunks
  Batch 1/1: Embedding 13 chunks...
  ✅ Upserted 13 vectors
  ✅ Complete

[5/136] PPP Podcast  intro call with John Lind
  Created 10 chunks
  Batch 1/1: Embedding 10 chunks...
  ✅ Upserted 10 vectors
  ✅ Complete

[6/136] PPP Podcast  intro call with Thomas Schneider
  Created 7 chunks
  Batch 1/1: Embedding 7 chunks...
  ✅ Upserted 7 vectors
  ✅ Complete

[7/136] nBrain | Meeting
  Created 12 chunks
  Batch 1/1: Embedding 12 chunks...
  ✅ Upserted 12 vectors
  ✅ Complete

[8/136] PPP Podcast  intro call with Jan Huisman
  Created 8 chunks
  Batch 1/1: Embedding 8 chunks...
  ✅ Upserted 8 vectors
  ✅ Complete

[9/136] PPP Podcast  intro call with Sam knotts
  Created 14 chunks
  Batch 1/1: Embedding 14 chunks...
  ✅ Upserted 14 vectors
  ✅ Complete

[10/136] From Scattered Tools to a Winning Asset: Building Your AI "Business Brain"
  Created 38 chunks
  Batch 1/1: Embedding 38 chunks...
  ✅ Upserted 38 vectors
  ✅ Complete

[11/136] PPP Podcast  intro call with George Kushner 
  Created 8 chunks
  Batch 1/1: Embedding 8 chunks...
  ✅ Upserted 8 vectors
  ✅ Complete

[12/136] PPP Podcast  intro call with Ken Morris 
  Created 8 chunks
  Batch 1/1: Embedding 8 chunks...
  ✅ Upserted 8 vectors
  ✅ Complete

[13/136] PPP Podcast  intro call with Wes Snow
  Created 6 chunks
  Batch 1/1: Embedding 6 chunks...
  ✅ Upserted 6 vectors
  ✅ Complete

[14/136] Liam Zirkle | Meeting 
  Created 21 chunks
  Batch 1/1: Embedding 21 chunks...
  ✅ Upserted 21 vectors
  ✅ Complete

[15/136] Heather Hook | Kick Off Call with KeyCrew Media
  Created 16 chunks
  Batch 1/1: Embedding 16 chunks...
  ✅ Upserted 16 vectors
  ✅ Complete

[16/136]  PPP Podcast  intro call with John D. Conway
  Created 12 chunks
  Batch 1/1: Embedding 12 chunks...
  ✅ Upserted 12 vectors
  ✅ Complete

[17/136] OpticWise + nBrain AI Kick-Off Meeting
  Created 17 chunks
  Batch 1/1: Embedding 17 chunks...
  ✅ Upserted 17 vectors
  ✅ Complete

[18/136] PPP Podcast  intro call with  Amanda Betts
  Created 10 chunks
  Batch 1/1: Embedding 10 chunks...
  ✅ Upserted 10 vectors
  ✅ Complete

[19/136] Shea Fallick | Meeting 
  Created 24 chunks
  Batch 1/1: Embedding 24 chunks...
  ✅ Upserted 24 vectors
  ✅ Complete

[20/136]  Ryan Elazari | Meeting 
  Created 20 chunks
  Batch 1/1: Embedding 20 chunks...
  ✅ Upserted 20 vectors
  ✅ Complete

[21/136] Marshall Johnson | Meeting
  Created 10 chunks
  Batch 1/1: Embedding 10 chunks...
  ✅ Upserted 10 vectors
  ✅ Complete

[22/136] Saharsh Chordia | Meeting
  Created 15 chunks
  Batch 1/1: Embedding 15 chunks...
  ✅ Upserted 15 vectors
  ✅ Complete

[23/136] PPP Podcast  intro call with Joe Tagliente
  Created 13 chunks
  Batch 1/1: Embedding 13 chunks...
  ✅ Upserted 13 vectors
  ✅ Complete

[24/136] 60 Minute Proptech-PR Consultancy.  with Andrew Stanton  CEO Proptech-PR
  Created 25 chunks
  Batch 1/1: Embedding 25 chunks...
  ✅ Upserted 25 vectors
  ✅ Complete

[25/136] Laura Roman | Content Creation
  Created 10 chunks
  Batch 1/1: Embedding 10 chunks...
  ✅ Upserted 10 vectors
  ✅ Complete

[26/136] Rosy
  Created 9 chunks
  Batch 1/1: Embedding 9 chunks...
  ✅ Upserted 9 vectors
  ✅ Complete

[27/136] John Simmons call
  Created 21 chunks
  Batch 1/1: Embedding 21 chunks...
  ✅ Upserted 21 vectors
  ✅ Complete

[28/136] Opticwise
  Created 13 chunks
  Batch 1/1: Embedding 13 chunks...
  ✅ Upserted 13 vectors
  ✅ Complete

[29/136] Jesse Futia | Bill Douglas- Meeting 
  Created 9 chunks
  Batch 1/1: Embedding 9 chunks...
  ✅ Upserted 9 vectors
  ✅ Complete

[30/136] PPP Podcast intro call with David Aaronson 
  Created 5 chunks
  Batch 1/1: Embedding 5 chunks...
  ✅ Upserted 5 vectors
  ✅ Complete

[31/136] Impromptu Zoom Meeting
  Created 8 chunks
  Batch 1/1: Embedding 8 chunks...
  ✅ Upserted 8 vectors
  ✅ Complete

[32/136] OpticWise + nBrain Meeting
  Created 26 chunks
  Batch 1/1: Embedding 26 chunks...
  ✅ Upserted 26 vectors
  ✅ Complete

[33/136] CH - WD catchup 
  Created 13 chunks
  Batch 1/1: Embedding 13 chunks...
  ✅ Upserted 13 vectors
  ✅ Complete

[34/136] Kit Edwards
  Created 27 chunks
  Batch 1/1: Embedding 27 chunks...
  ✅ Upserted 27 vectors
  ✅ Complete

[35/136] Opticwise + nBrain AI Meeting
  Created 24 chunks
  Batch 1/1: Embedding 24 chunks...
  ✅ Upserted 24 vectors
  ✅ Complete

[36/136] Jonathan Wilson
  Created 11 chunks
  Batch 1/1: Embedding 11 chunks...
  ✅ Upserted 11 vectors
  ✅ Complete

[37/136] Vertus Group Software Meeting
  Created 9 chunks
  Batch 1/1: Embedding 9 chunks...
  ✅ Upserted 9 vectors
  ✅ Complete

[38/136] Laura Roman
  Created 22 chunks
  Batch 1/1: Embedding 22 chunks...
  ✅ Upserted 22 vectors
  ✅ Complete

[39/136] Bill Douglas
  Created 24 chunks
  Batch 1/1: Embedding 24 chunks...
  ✅ Upserted 24 vectors
  ✅ Complete

[40/136] Neil Geary | Meeting 
  Created 12 chunks
  Batch 1/1: Embedding 12 chunks...
  ✅ Upserted 12 vectors
  ✅ Complete

[41/136] Mintleads | Meeting
  Created 13 chunks
  Batch 1/1: Embedding 13 chunks...
  ✅ Upserted 13 vectors
  ✅ Complete

[42/136] Opticwise and IpCapital Intro
  Created 11 chunks
  Batch 1/1: Embedding 11 chunks...
  ✅ Upserted 11 vectors
  ✅ Complete

[43/136] Impromptu Zoom Meeting
  Created 15 chunks
  Batch 1/1: Embedding 15 chunks...
  ✅ Upserted 15 vectors
  ✅ Complete

[44/136] Steve Marcinuk | KeyCrew
  Created 8 chunks
  Batch 1/1: Embedding 8 chunks...
  ✅ Upserted 8 vectors
  ✅ Complete

[45/136] Human Interest | Meeting
  Created 7 chunks
  Batch 1/1: Embedding 7 chunks...
  ✅ Upserted 7 vectors
  ✅ Complete

[46/136] HALO | Meeting
  Created 23 chunks
  Batch 1/1: Embedding 23 chunks...
  ✅ Upserted 23 vectors
  ✅ Complete

[47/136] Impromptu Zoom Meeting
  Created 42 chunks
  Batch 1/1: Embedding 42 chunks...
  ✅ Upserted 42 vectors
  ✅ Complete

[48/136] Sanjeev Kumar
  Created 4 chunks
  Batch 1/1: Embedding 4 chunks...
  ✅ Upserted 4 vectors
  ✅ Complete

[49/136] Impromptu Zoom Meeting
  Created 12 chunks
  Batch 1/1: Embedding 12 chunks...
  ✅ Upserted 12 vectors
  ✅ Complete

[50/136]  Mintleads | Meeting
  Created 1 chunks
  Batch 1/1: Embedding 1 chunks...
  ✅ Upserted 1 vectors
  ✅ Complete

[51/136]  Bob Ale Ebrahim | Interview  
  Created 14 chunks
  Batch 1/1: Embedding 14 chunks...
  ✅ Upserted 14 vectors
  ✅ Complete

[52/136] Brandon Marx | Meeting 
  Created 8 chunks
  Batch 1/1: Embedding 8 chunks...
  ✅ Upserted 8 vectors
  ✅ Complete

[53/136] Tom Pair | Meeting 
  Created 24 chunks
  Batch 1/1: Embedding 24 chunks...
  ✅ Upserted 24 vectors
  ✅ Complete

[54/136] 30 Minute Meeting with Nick Tyree
  Created 19 chunks
  Batch 1/1: Embedding 19 chunks...
  ✅ Upserted 19 vectors
  ✅ Complete

[55/136] Connor | Bill - Meeting 
  Created 19 chunks
  Batch 1/1: Embedding 19 chunks...
  ✅ Upserted 19 vectors
  ✅ Complete

[56/136]  Shea Fallick | Meeting
  Created 18 chunks
  Batch 1/1: Embedding 18 chunks...
  ✅ Upserted 18 vectors
  ✅ Complete

[57/136]  Luciano Rojo | Intro 
  Created 6 chunks
  Batch 1/1: Embedding 6 chunks...
  ✅ Upserted 6 vectors
  ✅ Complete

[58/136] DH-WD L10
  Created 27 chunks
  Batch 1/1: Embedding 27 chunks...
  ✅ Upserted 27 vectors
  ✅ Complete

[59/136] OPC recurring meeting - Troy Marquis
  Created 5 chunks
  Batch 1/1: Embedding 5 chunks...
  ✅ Upserted 5 vectors
  ✅ Complete

[60/136] Steve Marcinuk |  Interview Call w/ KeyCrew Media
  Created 15 chunks
  Batch 1/1: Embedding 15 chunks...
  ✅ Upserted 15 vectors
  ✅ Complete

[61/136] DH-WD L10
  Created 32 chunks
  Batch 1/1: Embedding 32 chunks...
  ✅ Upserted 32 vectors
  ✅ Complete

[62/136] Chris Geer | Meeting
  Created 14 chunks
  Batch 1/1: Embedding 14 chunks...
  ✅ Upserted 14 vectors
  ✅ Complete

[63/136] Charles Seaman | Meeting
  Created 11 chunks
  Batch 1/1: Embedding 11 chunks...
  ✅ Upserted 11 vectors
  ✅ Complete

[64/136] Blazel | LinkedIn images system
  Created 23 chunks
  Batch 1/1: Embedding 23 chunks...
  ✅ Upserted 23 vectors
  ✅ Complete

[65/136] COHORT 2: AI-Driven Leadership Collective™ Cohort 2 Launch Session
  Created 1 chunks
  Batch 1/1: Embedding 1 chunks...
  ✅ Upserted 1 vectors
  ✅ Complete

[66/136]  Ian Boyd | Meeting 
  Created 1 chunks
  Batch 1/1: Embedding 1 chunks...
  ✅ Upserted 1 vectors
  ✅ Complete

[67/136] Contract Review - Next Steps x CRE Digital 
  Created 12 chunks
  Batch 1/1: Embedding 12 chunks...
  ✅ Upserted 12 vectors
  ✅ Complete

[68/136] Bill Weiss call
  Created 26 chunks
  Batch 1/1: Embedding 26 chunks...
  ✅ Upserted 26 vectors
  ✅ Complete

[69/136] BoldLegal | Meeting 
  Created 6 chunks
  Batch 1/1: Embedding 6 chunks...
  ✅ Upserted 6 vectors
  ✅ Complete

[70/136] Scott Hurst Thrive AI Partners follow up
  Created 11 chunks
  Batch 1/1: Embedding 11 chunks...
  ✅ Upserted 11 vectors
  ✅ Complete

[71/136] Ryan Bradford | Meeting 
  Created 15 chunks
  Batch 1/1: Embedding 15 chunks...
  ✅ Upserted 15 vectors
  ✅ Complete

[72/136]  Meredi Lee | Meeting 
  Created 32 chunks
  Batch 1/1: Embedding 32 chunks...
  ✅ Upserted 32 vectors
  ✅ Complete

[73/136]  Jesse | Bill - Meeting
  Created 5 chunks
  Batch 1/1: Embedding 5 chunks...
  ✅ Upserted 5 vectors
  ✅ Complete

[74/136] FW: Abstrakt: Intro
  Created 22 chunks
  Batch 1/1: Embedding 22 chunks...
  ✅ Upserted 22 vectors
  ✅ Complete

[75/136] Impromptu Zoom Meeting
  Created 21 chunks
  Batch 1/1: Embedding 21 chunks...
  ✅ Upserted 21 vectors
  ✅ Complete

[76/136] Tom Pair  | Meeting 
  Created 9 chunks
  Batch 1/1: Embedding 9 chunks...
  ✅ Upserted 9 vectors
  ✅ Complete

[77/136] OPC recurring meeting - Troy Marquis
  Created 6 chunks
  Batch 1/1: Embedding 6 chunks...
  ✅ Upserted 6 vectors
  ✅ Complete

[78/136] Sean Connelly | Meeting
  Created 13 chunks
  Batch 1/1: Embedding 13 chunks...
  ✅ Upserted 13 vectors
  ✅ Complete

[79/136] Laura | Meeting 
  Created 28 chunks
  Batch 1/1: Embedding 28 chunks...
  ✅ Upserted 28 vectors
  ✅ Complete

[80/136] Laura | Bill Douglas - Meeting 
  Created 28 chunks
  Batch 1/1: Embedding 28 chunks...
  ✅ Upserted 28 vectors
  ✅ Complete

[81/136] Casey Berman | Meeting 
  Created 15 chunks
  Batch 1/1: Embedding 15 chunks...
  ✅ Upserted 15 vectors
  ✅ Complete

[82/136] Hiring AI Agents: Building Your Hybrid Human + AI Org Chart
  Created 41 chunks
  Batch 1/1: Embedding 41 chunks...
  ✅ Upserted 41 vectors
  ✅ Complete

[83/136] <> AIL Collective Onboarding
  Created 12 chunks
  Batch 1/1: Embedding 12 chunks...
  ✅ Upserted 12 vectors
  ✅ Complete

[84/136]  Stephen Levitan | Meeting
  Created 11 chunks
  Batch 1/1: Embedding 11 chunks...
  ✅ Upserted 11 vectors
  ✅ Complete

[85/136] Laurent Cochet - AI InterConnect
  Created 7 chunks
  Batch 1/1: Embedding 7 chunks...
  ✅ Upserted 7 vectors
  ✅ Complete

[86/136] Lane Taylor | Meeting 
  Created 9 chunks
  Batch 1/1: Embedding 9 chunks...
  ✅ Upserted 9 vectors
  ✅ Complete

[87/136] Michael Beckerman | Meeting
  Created 9 chunks
  Batch 1/1: Embedding 9 chunks...
  ✅ Upserted 9 vectors
  ✅ Complete

[88/136] Jim Hyde | Meeting 
  Created 11 chunks
  Batch 1/1: Embedding 11 chunks...
  ✅ Upserted 11 vectors
  ✅ Complete

[89/136] Impromptu Zoom Meeting
  Created 28 chunks
  Batch 1/1: Embedding 28 chunks...
  ✅ Upserted 28 vectors
  ✅ Complete

[90/136] OPC recurring meeting - Troy Marquis
  Created 9 chunks
  Batch 1/1: Embedding 9 chunks...
  ✅ Upserted 9 vectors
  ✅ Complete

[91/136] Bill x CRE Digital Sync 
  Created 23 chunks
  Batch 1/1: Embedding 23 chunks...
  ✅ Upserted 23 vectors
  ✅ Complete

[92/136] Bill x CRE Digital Sync 
  Created 23 chunks
  Batch 1/1: Embedding 23 chunks...
  ✅ Upserted 23 vectors
  ✅ Complete

[93/136] Travis + Bill Interview
  Created 27 chunks
  Batch 1/1: Embedding 27 chunks...
  ✅ Upserted 27 vectors
  ✅ Complete

[94/136] Bill - CRE Digital Sync 
  Created 8 chunks
  Batch 1/1: Embedding 8 chunks...
  ✅ Upserted 8 vectors
  ✅ Complete

[95/136] Laurent Cochet - AI InterConnect
  Created 6 chunks
  Batch 1/1: Embedding 6 chunks...
  ✅ Upserted 6 vectors
  ✅ Complete

[96/136] CH & WD onboarding
  Created 11 chunks
  Batch 1/1: Embedding 11 chunks...
  ✅ Upserted 11 vectors
  ✅ Complete

[97/136] AI-Driven Leadership Collective™ Interview: Bill Douglas
  Created 15 chunks
  Batch 1/1: Embedding 15 chunks...
  ✅ Upserted 15 vectors
  ✅ Complete

[98/136] Impromptu Zoom Meeting
  Created 11 chunks
  Batch 1/1: Embedding 11 chunks...
  ✅ Upserted 11 vectors
  ✅ Complete

[99/136] Novacap | Meeting 
  Created 15 chunks
  Batch 1/1: Embedding 15 chunks...
  ✅ Upserted 15 vectors
  ✅ Complete

[100/136] CRE Digital 30 Day Review 
  Created 14 chunks
  Batch 1/1: Embedding 14 chunks...
  ✅ Upserted 14 vectors
  ✅ Complete

[101/136] Bill Douglas - CRE Digital 30 Day Review 
  Created 14 chunks
  Batch 1/1: Embedding 14 chunks...
  ✅ Upserted 14 vectors
  ✅ Complete

[102/136] CMH & WD coaching call
  Created 1 chunks
  Batch 1/1: Embedding 1 chunks...
  ✅ Upserted 1 vectors
  ✅ Complete

[103/136] Michael Beckerman | Meeting
  Created 16 chunks
  Batch 1/1: Embedding 16 chunks...
  ✅ Upserted 16 vectors
  ✅ Complete

[104/136] Impromptu Microsoft Teams Meeting
  Created 19 chunks
  Batch 1/1: Embedding 19 chunks...
  ✅ Upserted 19 vectors
  ✅ Complete

[105/136] Mike Miller | Meeting 
  Created 15 chunks
  Batch 1/1: Embedding 15 chunks...
  ✅ Upserted 15 vectors
  ✅ Complete

[106/136] Blazel LI Login 
  Created 4 chunks
  Batch 1/1: Embedding 4 chunks...
  ✅ Upserted 4 vectors
  ✅ Complete

[107/136] Content Call - Nick Maciag
  Created 19 chunks
  Batch 1/1: Embedding 19 chunks...
  ✅ Upserted 19 vectors
  ✅ Complete

[108/136] Laurent Cochet - AI InterConnect
  Created 7 chunks
  Batch 1/1: Embedding 7 chunks...
  ✅ Upserted 7 vectors
  ✅ Complete

[109/136] Jake Cummins | Meeting
  Created 17 chunks
  Batch 1/1: Embedding 17 chunks...
  ✅ Upserted 17 vectors
  ✅ Complete

[110/136] Connor Hunt | Meeting
  Created 25 chunks
  Batch 1/1: Embedding 25 chunks...
  ✅ Upserted 25 vectors
  ✅ Complete

[111/136]  Jim Hyde | Meeting
  Created 3 chunks
  Batch 1/1: Embedding 3 chunks...
  ✅ Upserted 3 vectors
  ✅ Complete

[112/136] Arslan Smith
  Created 36 chunks
  Batch 1/1: Embedding 36 chunks...
  ✅ Upserted 36 vectors
  ✅ Complete

[113/136] OpticWise interview with Bisnow Studio B
  Created 14 chunks
  Batch 1/1: Embedding 14 chunks...
  ✅ Upserted 14 vectors
  ✅ Complete

[114/136] Lauren Coleman | Meeting 
  Created 12 chunks
  Batch 1/1: Embedding 12 chunks...
  ✅ Upserted 12 vectors
  ✅ Complete

[115/136] Blake Buden | Meeting
  Created 9 chunks
  Batch 1/1: Embedding 9 chunks...
  ✅ Upserted 9 vectors
  ✅ Complete

[116/136] Ella Salalac | Meeting
  Created 13 chunks
  Batch 1/1: Embedding 13 chunks...
  ✅ Upserted 13 vectors
  ✅ Complete

[117/136] Nicholas Leivici | Team Meeting
  Created 14 chunks
  Batch 1/1: Embedding 14 chunks...
  ✅ Upserted 14 vectors
  ✅ Complete

[118/136] Final Onboarding Call 
  Created 10 chunks
  Batch 1/1: Embedding 10 chunks...
  ✅ Upserted 10 vectors
  ✅ Complete

[119/136] work on book website
  Created 11 chunks
  Batch 1/1: Embedding 11 chunks...
  ✅ Upserted 11 vectors
  ✅ Complete

[120/136] Bill Douglas x Content Interview - CRE Digital 
  Created 23 chunks
  Batch 1/1: Embedding 23 chunks...
  ✅ Upserted 23 vectors
  ✅ Complete

[121/136] Zain Jaffer
  Created 29 chunks
  Batch 1/1: Embedding 29 chunks...
  ✅ Upserted 29 vectors
  ✅ Complete

[122/136] Ryan Detlaff | Team Meeting
  Created 11 chunks
  Batch 1/1: Embedding 11 chunks...
  ✅ Upserted 11 vectors
  ✅ Complete

[123/136] OpticWise kickoff with Bisnow Studio B
  Created 10 chunks
  Batch 1/1: Embedding 10 chunks...
  ✅ Upserted 10 vectors
  ✅ Complete

[124/136] Dean Koelbel | Meeting 
  Created 13 chunks
  Batch 1/1: Embedding 13 chunks...
  ✅ Upserted 13 vectors
  ✅ Complete

[125/136] Anthony Carlton
  Created 23 chunks
  Batch 1/1: Embedding 23 chunks...
  ✅ Upserted 23 vectors
  ✅ Complete

[126/136]  Zain Jaffer | Meeting
  Created 24 chunks
  Batch 1/1: Embedding 24 chunks...
  ✅ Upserted 24 vectors
  ✅ Complete

[127/136] Laura Cain
  Created 19 chunks
  Batch 1/1: Embedding 19 chunks...
  ✅ Upserted 19 vectors
  ✅ Complete

[128/136]  Scott Robinson | Meeting 
  Created 11 chunks
  Batch 1/1: Embedding 11 chunks...
  ✅ Upserted 11 vectors
  ✅ Complete

[129/136] 60 Minute Proptech-PR Consultancy.  with Andrew Stanton  CEO Proptech-PR
  Created 25 chunks
  Batch 1/1: Embedding 25 chunks...
  ✅ Upserted 25 vectors
  ✅ Complete

[130/136] Laura Cain | Meeting
  Created 16 chunks
  Batch 1/1: Embedding 16 chunks...
  ✅ Upserted 16 vectors
  ✅ Complete

[131/136] Crexi Intel | Bill Douglas
  Created 12 chunks
  Batch 1/1: Embedding 12 chunks...
  ✅ Upserted 12 vectors
  ✅ Complete

[132/136] Bill Douglas x IIC-Capital with Tanaha 
  Created 10 chunks
  Batch 1/1: Embedding 10 chunks...
  ✅ Upserted 10 vectors
  ✅ Complete

[133/136] Bill Douglas | Ocean Gross- meeting 
  Created 17 chunks
  Batch 1/1: Embedding 17 chunks...
  ✅ Upserted 17 vectors
  ✅ Complete

[134/136]  Anthony Carlton | Bill Douglas- Meeting
  Created 17 chunks
  Batch 1/1: Embedding 17 chunks...
  ✅ Upserted 17 vectors
  ✅ Complete

[135/136] Prospex by MintLeads.io
  Created 15 chunks
  Batch 1/1: Embedding 15 chunks...
  ✅ Upserted 15 vectors
  ✅ Complete

[136/136] Fathom Demo
  Created 5 chunks
  Batch 1/1: Embedding 5 chunks...
  ✅ Upserted 5 vectors
  ✅ Complete


=================================================
✅ Vectorization Complete!
=================================================
Total vectors created: 2030
Total transcripts: 136

🎉 OWnet Agent is now powered by your transcripts!

